"entity_id","entity_name","entity_description","entity_type_hint","entity_confidence","entity_resolution_context","entity_flag","class_id","class_label","class_group","chunk_ids","node_properties"
"En_2cd10c1a","white","The color white, which carries differing cultural associations such as purity or mourning.","Color","0.96","For example, while white is associated with purity and cleanliness in Western cultures, it is often associated with mourning and death in Eastern cultures.","entity_raw","ClsC_25ad8923","Cultural Color Symbolism of White","Color Symbolism and Cultural Interpretation","[""Ch_000004""]","[]"
"En_a188b2df","successful and memorable brand","A brand that achieves its goals and is easily recalled by consumers.","BrandOutcome","0.9","By carefully choosing the right colors and considering cultural and contextual factors, businesses can leverage the power of color psychology to create a successful and memorable brand.","entity_raw","ClsC_d1d823d4","Brand Outcome: Successful and Memorable Brand","Brands and Branding Outcomes","[""Ch_000005""]","[]"
"En_c420596c","brand's personality","Set of human-like traits consumers attribute to a brand, shaped by color.","BrandPerception","0.92","Research has shown that colors can affect how consumers perceive a brand's personality, quality, and value.","entity_raw","ClsR_31748c2c","Brand Perception Dimensions","Consumer Psychology and Behavior in Branding","[""Ch_000002""]","[]"
"En_6f21b441","brand quality perception","Consumer judgment of how good or superior a brand is, influenced by color.","BrandPerception","0.88","Research has shown that colors can affect how consumers perceive a brand's personality, quality, and value.","entity_raw","ClsR_31748c2c","Brand Perception Dimensions","Consumer Psychology and Behavior in Branding","[""Ch_000002""]","[]"
"En_aa311568","brand value perception","Consumer judgment of the worth or value offered by a brand, influenced by color.","BrandPerception","0.88","Research has shown that colors can affect how consumers perceive a brand's personality, quality, and value.","entity_raw","ClsR_31748c2c","Brand Perception Dimensions","Consumer Psychology and Behavior in Branding","[""Ch_000002""]","[]"
