"entity_id","entity_name","entity_description","entity_type_hint","entity_confidence","entity_resolution_context","entity_flag","class_id","class_label","class_group","chunk_ids","node_properties"
"En_5b989821","Western cultures","Cultures from Western regions where white often symbolizes purity and cleanliness.","Culture","0.94","For example, while white is associated with purity and cleanliness in Western cultures, it is often associated with mourning and death in Eastern cultures.","entity_raw","ClsC_74c4a4e1","Cultural Regions (Color Symbolism Contexts)","Color Symbolism and Cultural Interpretation","[""Ch_000004""]","[]"
"En_df2d64e1","Eastern cultures","Cultures from Eastern regions where white often signifies mourning and death.","Culture","0.94","For example, while white is associated with purity and cleanliness in Western cultures, it is often associated with mourning and death in Eastern cultures.","entity_raw","ClsC_74c4a4e1","Cultural Regions (Color Symbolism Contexts)","Color Symbolism and Cultural Interpretation","[""Ch_000004""]","[]"
"En_118e4ec8","purity","A positive quality symbolically associated with the color white in some cultures.","AbstractQuality","0.9","For example, while white is associated with purity and cleanliness in Western cultures, it is often associated with mourning and death in Eastern cultures.","entity_raw","ClsC_a717e95f","Symbolic Associations of White","Color Symbolism and Cultural Interpretation","[""Ch_000004""]","[]"
"En_eea798a0","cleanliness","A quality or state symbolically linked to the color white in Western cultures.","AbstractQuality","0.9","For example, while white is associated with purity and cleanliness in Western cultures, it is often associated with mourning and death in Eastern cultures.","entity_raw","ClsC_a717e95f","Symbolic Associations of White","Color Symbolism and Cultural Interpretation","[""Ch_000004""]","[]"
"En_0feb2d43","mourning","A state of grief symbolically associated with the color white in some Eastern cultures.","AbstractState","0.9","For example, while white is associated with purity and cleanliness in Western cultures, it is often associated with mourning and death in Eastern cultures.","entity_raw","ClsC_a717e95f","Symbolic Associations of White","Color Symbolism and Cultural Interpretation","[""Ch_000004""]","[]"
"En_72901ab6","death","An event or concept symbolically linked with the color white in Eastern cultures.","AbstractConcept","0.9","For example, while white is associated with purity and cleanliness in Western cultures, it is often associated with mourning and death in Eastern cultures.","entity_raw","ClsC_a717e95f","Symbolic Associations of White","Color Symbolism and Cultural Interpretation","[""Ch_000004""]","[]"
"En_5de67262","red","Color associated with passion, energy, excitement, and creating urgency in branding contexts.","Attribute","0.98","For example, red is often associated with passion, energy, and excitement, while blue is associated with trust, reliability, and calmness. For example, using warm colors like red and orange can create a sense of urgency and encourage impulse purchases.","entity_raw","ClsC_8ce6abcc","Brand Color Attributes","Color Psychology & Consumer Response in Branding","[""Ch_000002""]","[]"
"En_04ebdced","blue","Color associated with trust, reliability, calmness, and fostering a sense of trust in branding.","Attribute","0.98","For example, red is often associated with passion, energy, and excitement, while blue is associated with trust, reliability, and calmness. For example, using warm colors like red and orange can create a sense of urgency and encourage impulse purchases, while using cool colors like blue and green can create a sense of trust and reliability.","entity_raw","ClsC_8ce6abcc","Brand Color Attributes","Color Psychology & Consumer Response in Branding","[""Ch_000002""]","[]"
"En_7392feca","orange","Warm color used in branding to create urgency and encourage impulse purchases.","Attribute","0.96","For example, using warm colors like red and orange can create a sense of urgency and encourage impulse purchases, while using cool colors like blue and green can create a sense of trust and reliability.","entity_raw","ClsC_8ce6abcc","Brand Color Attributes","Color Psychology & Consumer Response in Branding","[""Ch_000002""]","[]"
"En_15e5fc11","green","Cool color used in branding to convey trust and reliability.","Attribute","0.96","For example, using warm colors like red and orange can create a sense of urgency and encourage impulse purchases, while using cool colors like blue and green can create a sense of trust and reliability.","entity_raw","ClsC_8ce6abcc","Brand Color Attributes","Color Psychology & Consumer Response in Branding","[""Ch_000002""]","[]"
"En_a0ebfc40","warm colors","Color group including hues like red and orange, used to create urgency and drive impulse purchases.","AttributeGroup","0.9","For example, using warm colors like red and orange can create a sense of urgency and encourage impulse purchases, while using cool colors like blue and green can create a sense of trust and reliability.","entity_raw","ClsC_6b6f7f56","Color Temperature Groups","Color Psychology & Consumer Response in Branding","[""Ch_000002""]","[]"
"En_c4e73e40","cool colors","Color group including hues like blue and green, used to convey trust and reliability.","AttributeGroup","0.9","For example, using warm colors like red and orange can create a sense of urgency and encourage impulse purchases, while using cool colors like blue and green can create a sense of trust and reliability.","entity_raw","ClsC_6b6f7f56","Color Temperature Groups","Color Psychology & Consumer Response in Branding","[""Ch_000002""]","[]"
"Can_52a901a5","emotions","Affective feelings or psychological states experienced by consumers that can be triggered or influenced by color in branding and marketing contexts.","PsychologicalState","0.93","Both mentions refer to the same general psychological concept of consumer feelings evoked by color in branding, with identical name and highly similar descriptions.","entity_raw","ClsC_9b59b958","Color-Evoked Emotions in Branding","Color Psychology & Consumer Response in Branding","[""Ch_000001"", ""Ch_000005""]","[]"
"En_b73813bb","passion","Emotion commonly associated with the color red in branding.","Emotion","0.9","For example, red is often associated with passion, energy, and excitement, while blue is associated with trust, reliability, and calmness.","entity_raw","ClsC_9b59b958","Color-Evoked Emotions in Branding","Color Psychology & Consumer Response in Branding","[""Ch_000002""]","[]"
"En_80b5efd4","energy","High-arousal emotional quality associated with the color red in branding contexts.","Emotion","0.9","For example, red is often associated with passion, energy, and excitement, while blue is associated with trust, reliability, and calmness.","entity_raw","ClsC_9b59b958","Color-Evoked Emotions in Branding","Color Psychology & Consumer Response in Branding","[""Ch_000002""]","[]"
"En_875bc7ff","excitement","Emotion evoked by the color red in branding and marketing.","Emotion","0.9","For example, red is often associated with passion, energy, and excitement, while blue is associated with trust, reliability, and calmness.","entity_raw","ClsC_9b59b958","Color-Evoked Emotions in Branding","Color Psychology & Consumer Response in Branding","[""Ch_000002""]","[]"
"En_5a7b0e25","calmness","Low-arousal emotional state associated with the color blue in branding.","Emotion","0.9","For example, red is often associated with passion, energy, and excitement, while blue is associated with trust, reliability, and calmness.","entity_raw","ClsC_9b59b958","Color-Evoked Emotions in Branding","Color Psychology & Consumer Response in Branding","[""Ch_000002""]","[]"
"En_34fd5414","trust","Perceived brand trait and emotion associated with blue and cool colors.","BrandPerception","0.93","For example, red is often associated with passion, energy, and excitement, while blue is associated with trust, reliability, and calmness. For example, using warm colors like red and orange can create a sense of urgency and encourage impulse purchases, while using cool colors like blue and green can create a sense of trust and reliability.","entity_raw","ClsC_038269ad","Cool Color Brand Traits","Color Psychology & Consumer Response in Branding","[""Ch_000002""]","[]"
"En_6e135e03","reliability","Perceived brand trait associated with blue and cool colors in branding.","BrandPerception","0.93","For example, red is often associated with passion, energy, and excitement, while blue is associated with trust, reliability, and calmness. For example, using warm colors like red and orange can create a sense of urgency and encourage impulse purchases, while using cool colors like blue and green can create a sense of trust and reliability.","entity_raw","ClsC_038269ad","Cool Color Brand Traits","Color Psychology & Consumer Response in Branding","[""Ch_000002""]","[]"
"En_b49a03b6","sense of urgency","Psychological state of time pressure created by warm colors like red and orange.","PsychologicalState","0.92","For example, using warm colors like red and orange can create a sense of urgency and encourage impulse purchases.","entity_raw","ClsC_80308e7a","Warm Color Purchase Activation","Color Psychology & Consumer Response in Branding","[""Ch_000002""]","[]"
"En_0195a6ea","impulse purchases","Unplanned buying decisions encouraged by using warm colors in branding.","ConsumerBehavior","0.94","For example, using warm colors like red and orange can create a sense of urgency and encourage impulse purchases.","entity_raw","ClsC_80308e7a","Warm Color Purchase Activation","Color Psychology & Consumer Response in Branding","[""Ch_000002""]","[]"
"En_ead322a9","bright yellow of McDonald's arches","The bright yellow color used in the McDonald's arch symbol, serving as a recognizable brand color.","DesignElement","0.96","For example, the bright yellow of McDonald's arches or the iconic red of Coca-Cola's logo are instantly recognizable and help these brands stand out in the minds of consumers.","entity_raw","ClsC_774fecf4","Brand Colors","Brand Visual Identity","[""Ch_000003""]","[]"
"En_a86bd987","iconic red of Coca-Cola's logo","The iconic red color used in the Coca-Cola logo, functioning as a key brand identifier.","DesignElement","0.96","For example, the bright yellow of McDonald's arches or the iconic red of Coca-Cola's logo are instantly recognizable and help these brands stand out in the minds of consumers.","entity_raw","ClsC_774fecf4","Brand Colors","Brand Visual Identity","[""Ch_000003""]","[]"
"En_7a44a644","McDonald's arches","The arch-shaped McDonald's symbol commonly depicted in bright yellow.","LogoElement","0.94","For example, the bright yellow of McDonald's arches or the iconic red of Coca-Cola's logo are instantly recognizable and help these brands stand out in the minds of consumers.","entity_raw","ClsC_4a53bcaa","Brand Logos","Brand Visual Identity","[""Ch_000003""]","[]"
"En_ceb4c803","Coca-Cola's logo","The red-colored logo symbolizing the Coca-Cola beverage brand.","Logo","0.94","For example, the bright yellow of McDonald's arches or the iconic red of Coca-Cola's logo are instantly recognizable and help these brands stand out in the minds of consumers.","entity_raw","ClsC_4a53bcaa","Brand Logos","Brand Visual Identity","[""Ch_000003""]","[]"
"En_8bc7bdce","McDonald's","A global fast-food brand identified by its bright yellow arches.","Brand","0.9","For example, the bright yellow of McDonald's arches or the iconic red of Coca-Cola's logo are instantly recognizable and help these brands stand out in the minds of consumers.","entity_raw","ClsC_549334c1","Consumer Brand Examples","Brands and Branding Outcomes","[""Ch_000003""]","[]"
"En_b9850977","Coca-Cola","A global beverage brand associated strongly with a red logo.","Brand","0.9","For example, the bright yellow of McDonald's arches or the iconic red of Coca-Cola's logo are instantly recognizable and help these brands stand out in the minds of consumers.","entity_raw","ClsC_549334c1","Consumer Brand Examples","Brands and Branding Outcomes","[""Ch_000003""]","[]"
"En_d6773230","cultural associations of different colors","Culture-specific meanings and connections people attach to particular colors.","Concept","0.93","When choosing colors for branding, it is important to consider the cultural and contextual associations of different colors.","entity_raw","ClsC_cf69a0d0","Color Interpretation Factors","Color Symbolism and Cultural Interpretation","[""Ch_000003""]","[]"
"En_de5ff5e4","contextual associations of different colors","Context-dependent meanings linked to colors in particular situations or settings.","Concept","0.93","When choosing colors for branding, it is important to consider the cultural and contextual associations of different colors.","entity_raw","ClsC_cf69a0d0","Color Interpretation Factors","Color Symbolism and Cultural Interpretation","[""Ch_000003""]","[]"
"En_db4ca513","cultural and contextual factors","Cultural norms and situational contexts that affect how colors and brands are interpreted.","Concept","0.94","By carefully choosing the right colors and considering cultural and contextual factors, businesses can leverage the power of color psychology to create a successful and memorable brand.","entity_raw","ClsC_91c2c9cb","Branding Cultural Context","Branding, Positioning & Market Context","[""Ch_000005""]","[]"
"En_55d673c5","different cultures","Distinct cultural groups whose traditions and values influence the meanings of colors.","Culture","0.9","Colors can have different meanings and associations in different cultures, so businesses should be mindful of how their color choices may be perceived in different markets.","entity_raw","ClsC_91c2c9cb","Branding Cultural Context","Branding, Positioning & Market Context","[""Ch_000004""]","[]"
"En_4322b02a","cultural considerations","Factors related to cultural meanings that businesses must account for in branding.","Concept","0.86","In addition to cultural considerations, businesses should also consider the context in which their brand will be presented.","entity_raw","ClsC_91c2c9cb","Branding Cultural Context","Branding, Positioning & Market Context","[""Ch_000004""]","[]"
"En_1cb31295","context","The situational setting in which a brand and its colors are presented.","Concept","0.86","In addition to cultural considerations, businesses should also consider the context in which their brand will be presented.","entity_raw","ClsC_91c2c9cb","Branding Cultural Context","Branding, Positioning & Market Context","[""Ch_000004""]","[]"
"Can_dff77fa2","consumer brand perceptions","Overall ways consumers interpret, evaluate, and form views of brands (including personality, quality, and value), which can be influenced by color usage.","BrandPerception","0.9","Both describe consumer interpretations or views of brands shaped by color; one is labeled generically as 'perceptions' but context clearly ties it to consumer brand perceptions.","entity_raw","ClsC_c0b00e43","Consumer Brand Perception (Overall)","Consumer Psychology and Behavior in Branding","[""Ch_000002"", ""Ch_000005""]","[]"
"En_47f7b2e3","bright and bold color palette","A vivid, high-intensity combination of colors used to visually represent a brand.","DesignChoice","0.96","For example, a bright and bold color palette may be appropriate for a youth-oriented brand, while a more muted and sophisticated color scheme may be more suitable for a luxury brand.","entity_raw","ClsC_4565f553","Brand Color Palette Style","Brand Visual Identity & Styling","[""Ch_000005""]","[]"
"En_bed0371f","muted and sophisticated color scheme","A restrained, subtle, and elegant set of colors chosen for brand visuals.","DesignChoice","0.95","For example, a bright and bold color palette may be appropriate for a youth-oriented brand, while a more muted and sophisticated color scheme may be more suitable for a luxury brand.","entity_raw","ClsC_4565f553","Brand Color Palette Style","Brand Visual Identity & Styling","[""Ch_000005""]","[]"
"En_eafa072d","youth-oriented brand","A brand primarily targeting younger consumers as its main audience.","BrandType","0.95","For example, a bright and bold color palette may be appropriate for a youth-oriented brand, while a more muted and sophisticated color scheme may be more suitable for a luxury brand.","entity_raw","ClsC_3fe44b55","Brand Positioning Segment","Branding, Positioning & Market Context","[""Ch_000005""]","[]"
"En_7e00fb90","luxury brand","A high-end brand positioned around exclusivity, premium quality, and status.","BrandType","0.95","For example, a bright and bold color palette may be appropriate for a youth-oriented brand, while a more muted and sophisticated color scheme may be more suitable for a luxury brand.","entity_raw","ClsC_3fe44b55","Brand Positioning Segment","Branding, Positioning & Market Context","[""Ch_000005""]","[]"
"En_294a6875","competitors","Other brands in the same marketplace that a brand seeks to stand out from.","MarketActorGroup","0.9","Furthermore, colors can help differentiate a brand from its competitors and create a unique and memorable brand identity. By choosing a distinctive color scheme, businesses can stand out in a crowded marketplace.","entity_raw","ClsC_81d53444","Brand Positioning Contexts","Branding, Positioning & Market Context","[""Ch_000003""]","[]"
"En_b5096568","crowded marketplace","A competitive market environment with many brands vying for attention.","Environment","0.88","By choosing a distinctive color scheme, businesses can stand out in a crowded marketplace and create a strong brand presence.","entity_raw","ClsC_81d53444","Brand Positioning Contexts","Branding, Positioning & Market Context","[""Ch_000003""]","[]"
"En_c4404eda","strong brand presence","A brand’s noticeable and impactful visibility in the marketplace.","Concept","0.9","By choosing a distinctive color scheme, businesses can stand out in a crowded marketplace and create a strong brand presence.","entity_raw","ClsC_81d53444","Brand Positioning Contexts","Branding, Positioning & Market Context","[""Ch_000003""]","[]"
"En_06e2379a","brand positioning","How a brand is placed in the market and perceived, influencing color effects.","Concept","0.9","The same color may have different meanings and effects depending on the industry, target audience, and brand positioning.","entity_raw","ClsC_1a2002aa","Brand Strategy Concepts","Branding, Positioning & Market Context","[""Ch_000004""]","[]"
"En_141d1891","brand differentiation","The distinctiveness a brand achieves relative to competitors, partly through color.","BrandAttribute","0.94","By understanding how colors can evoke emotions, influence perceptions, and create brand differentiation, businesses can create a strong and impactful brand identity that resonates with their target audience.","entity_raw","ClsC_1a2002aa","Brand Strategy Concepts","Branding, Positioning & Market Context","[""Ch_000005""]","[]"
"Can_304e0fa9","color psychology in branding","The study and application of how colors and their psychological and emotional associations—including the specific messages and meanings they convey—affect perceptions, emotions, and behaviors in branding and marketing contexts, used to shape brand identity and influence consumer responses.","Concept","0.97","Both entities refer to the same underlying concept of how colors communicate meanings and influence consumer perception and behavior in branding, differing only in phrasing and scope.","entity_raw","ClsC_985dae73","Brand Communication Concepts","Branding, Positioning & Market Context","[""Ch_000001"", ""Ch_000005""]","[]"
"Can_f8b29acb","branding and marketing strategies","Planned approaches businesses use in branding and marketing to influence consumer perceptions and behavior, including the use of elements like color.","Process","0.93","Both mentions describe the same set of planned approaches in a branding/marketing context and appear in closely related text about color psychology in marketing.","entity_raw","ClsC_985dae73","Brand Communication Concepts","Branding, Positioning & Market Context","[""Ch_000001"", ""Ch_000005""]","[]"
"Can_6c536a5c","target audience","The specific group of consumers a brand aims to reach, whose preferences and perceptions influence how branding elements like color are interpreted.","Audience","0.95","All four mentions use the same phrase in a branding context and describe the same concept of the consumer group a brand aims to reach.","entity_raw","ClsC_985dae73","Brand Communication Concepts","Branding, Positioning & Market Context","[""Ch_000001"", ""Ch_000002"", ""Ch_000004"", ""Ch_000005""]","[]"
"En_835db950","desired message","Specific communicative intent a brand wants to convey through its color choices.","CommunicationGoal","0.86","By choosing the right colors for their brand, businesses can create a visual identity that resonates with their target audience and conveys the desired message.","entity_raw","ClsC_985dae73","Brand Communication Concepts","Branding, Positioning & Market Context","[""Ch_000002""]","[]"
"Can_16de8ee7","color in branding and design","Use and selection of colors as visual attributes in branding and design to differentiate brands, create recognizable identities, and convey symbolic meanings, emotions, and marketing messages across markets and cultures.","Concept","0.96","Both entities describe the same conceptual use of color in branding/marketing contexts, differing only in phrasing and granularity.","entity_raw","ClsC_96180094","Branding Concepts","Branding, Positioning & Market Context","[""Ch_000001"", ""Ch_000002"", ""Ch_000003"", ""Ch_000004""]","[]"
"Can_a6ff2732","brand visual identity","The overall visual and conceptual representation of a brand—its distinct image, personality, and memorability—created through design, color choices, and other visual elements.","BrandAsset","0.96","Both refer to the same notion of a brand’s overall visual identity shaped by color and design, differing only in wording and type hint granularity.","entity_raw","ClsC_96180094","Branding Concepts","Branding, Positioning & Market Context","[""Ch_000001"", ""Ch_000002"", ""Ch_000003"", ""Ch_000005""]","[]"
"Can_e95a1c74","branding","The practice and process of creating, building, and managing a brand’s identity and perception, including choices such as colors and other design elements.","Concept","0.95","Both describe the same process of creating and managing brand identity, with nearly identical meanings despite slightly different type hints.","entity_raw","ClsC_96180094","Branding Concepts","Branding, Positioning & Market Context","[""Ch_000001"", ""Ch_000003""]","[]"
"Can_345a35bb","brand","A business or organization's overall identity and presentation, including its personality, visual elements, and market positioning, which colors help shape and distinguish.","Brand","0.93","All three refer to the same general concept of a business/organization’s brand identity shaped and differentiated by color choices, not to distinct specific brands.","entity_raw","ClsC_96180094","Branding Concepts","Branding, Positioning & Market Context","[""Ch_000002"", ""Ch_000003"", ""Ch_000004""]","[]"
"En_d7e5a02f","different markets","Various geographic or cultural market segments where brands are presented.","Market","0.88","Colors can have different meanings and associations in different cultures, so businesses should be mindful of how their color choices may be perceived in different markets.","entity_raw","ClsC_d4bc59ca","Brand Context Factors","Branding, Positioning & Market Context","[""Ch_000004""]","[]"
"En_5fc95647","industry","The business sector in which a brand operates, influencing color meanings and effects.","Industry","0.87","The same color may have different meanings and effects depending on the industry, target audience, and brand positioning.","entity_raw","ClsC_d4bc59ca","Brand Context Factors","Branding, Positioning & Market Context","[""Ch_000004""]","[]"
"Can_c45bf0ba","consumer behavior","Observable actions and decisions of consumers, such as purchasing, that can be influenced by color in branding and marketing.","Behavior","0.95","Both mentions refer to the same concept: the actions and decisions of consumers affected by color, differing only in singular vs. plural wording.","entity_raw","ClsC_4ee99d85","Consumer Behavior","Consumer Psychology and Behavior in Branding","[""Ch_000001"", ""Ch_000002""]","[]"
"Can_65437ecd","businesses","Organizations and brands that use color psychology and visual identity strategies to shape branding, differentiate themselves, and connect with target audiences in various markets.","Organization","0.9","All four mentions refer generically to the same concept of organizations/brands using color in branding rather than to distinct organizations.","entity_raw","ClsC_02bab5d1","Brands Using Color Strategy","Branding and Visual Identity","[""Ch_000001"", ""Ch_000002"", ""Ch_000003"", ""Ch_000004""]","[]"
"En_885c5772","distinctive color scheme","A unique combination of colors selected by a business for branding.","DesignElement","0.94","By choosing a distinctive color scheme, businesses can stand out in a crowded marketplace and create a strong brand presence.","entity_raw","ClsC_9652a643","Brand Color Scheme","Branding and Visual Identity","[""Ch_000003""]","[]"
"En_92d56af0","consumers","People whose minds recognize and distinguish brands by their colors.","Actor","0.9","For example, the bright yellow of McDonald's arches or the iconic red of Coca-Cola's logo are instantly recognizable and help these brands stand out in the minds of consumers.","entity_raw","ClsC_a635692e","Consumers","Consumer Psychology and Behavior in Branding","[""Ch_000003""]","[]"
